{
  "schemaVersion": 1,
  "projectId": "sample-empty",
  "title": "新規プロジェクト",
  "documentDate": "2026-10-06",
  "profile": {
    "postalCode": "",
    "address": "",
    "addressKana": "",
    "phone": "",
    "email": "",
    "name": "",
    "nameKana": "",
    "birthDate": "",
    "photoAssetId": null
  },
  "resume": {
    "education": [],
    "employment": [],
    "qualifications": [],
    "motivation": {
      "type": "doc",
      "content": [
        {
          "type": "paragraph"
        }
      ]
    },
    "preferences": {
      "type": "doc",
      "content": [
        {
          "type": "paragraph"
        }
      ]
    }
  },
  "career": {
    "summary": {
      "type": "doc",
      "content": [
        {
          "type": "paragraph"
        }
      ]
    },
    "positions": [],
    "skills": [],
    "selfPromotion": {
      "type": "doc",
      "content": [
        {
          "type": "paragraph"
        }
      ]
    },
    "qualifications": []
  },
  "templates": {
    "resume": {
      "id": "resume-standard",
      "version": "1.2.0"
    },
    "career": {
      "id": "career-standard",
      "version": "1.2.0"
    }
  },
  "assets": []
}
